{
  "schemaVersion": "openaccp-frontier-closure.v1",
  "artifactType": "frontier-closure",
  "closureId": "FC-<lane>-001",
  "laneId": "<lane-id>",
  "responseId": "<response-id>",
  "authorityLevel": "B2",
  "branchState": "open",
  "gapDecisionMatrix": [
    {
      "gap": "<visible-gap>",
      "decision": "do_now",
      "nextSafeAction": "Frontier continues B0/B1/B2 work in this lane."
    }
  ],
  "childLedgerRef": ".openaccp/coordination/child-ledgers/<lane-id>.json",
  "allChildrenTerminal": false,
  "allChildHandoffsConsumedOrRejected": false,
  "branchReturnGate": {
    "state": "not_ready",
    "safeWorkRemainingCount": 1,
    "finalAuthorityGapCount": 0,
    "explicitlyOutCount": 0,
    "primaryReadyPacketExists": false,
    "reason": "Frontier still has lane-local B0/B1/B2-safe work; this is a lane-progress packet, not a Primary-ready closure packet."
  },
  "laneProgressPacketRef": ".openaccp/coordination/frontier-packets/<lane-id>.lane-progress.md",
  "primaryReadyPacketRef": "",
  "blockedOnHumanReason": "",
  "remainingB0B1B2SafeWork": ["<safe lane-local work still available>"],
  "remainingFinalAuthorityGaps": [],
  "explicitlyOutGaps": [],
  "worktreeDecision": {
    "base": "<base-or-not_applicable>",
    "worktree": "<worktree-or-not_required>",
    "branch": "<branch-or-not_required>",
    "allowedFiles": ["<allowed-file-glob>"],
    "verification": ["<verification-check>"],
    "handoffPath": "<handoff-path>",
    "dataRisk": "low",
    "resourceUse": "local only",
    "noDispatchReason": "B2 dispatch fields are not ready yet."
  },
  "humanNextStep": "No human action is needed while Frontier still has B0/B1/B2-safe work. Frontier will continue lane-local discovery, packaging, dispatch, review, consume, and reclassification."
}
